ods	id	title	year	type	journal	esi	influscore	news	policy	twitter	wikipedia	authors
12	63638	Non-Linear Regression Modelling to Estimate the Global Warming Potential of a Newspaper	2020	Article	ENTROPY	Physics	5	0	0	8	0	3
12	63775	Anaerobic Digestion for Producing Renewable Energy-The Evolution of This Technology in a New Uncertain Scenario	2021	Review	ENTROPY	Physics	5	0	0	7	0	5
12	70355	Preliminary Study of New Sustainable, Alkali-Activated Cements Using the Residual Fraction of the Glass Cullet Recycling as Precursor	2021	Article	APPLIED SCIENCES-BASEL	Physics	5	0	0	6	0	6
12	70369	Toward Energy Savings in Campus Buildings under a Life Cycle Thinking Approach	2020	Article	APPLIED SCIENCES-BASEL	Physics	4	0	0	5	0	7
12	67206	Digital Manufacturing Platforms in the Industry 4.0 from Private and Public Perspectives	2019	Review	APPLIED SCIENCES-BASEL	Physics	2	0	0	4	0	4
12	70548	A Critical Review on the Impacts of Nanoplastics and Microplastics on Aquatic and Terrestrial Photosynthetic Organisms	2021	Review	SMALL	Physics	2	0	0	4	0	4
12	2618	Plastic debris straps on threatened blue shark Prionace glauca	2017	Article	MARINE POLLUTION BULLETIN	Plant & Animal Science	136	1	0	184	1	4
12	21950	Floating microplastics and aggregate formation in the Western Mediterranean Sea	2019	Article	MARINE POLLUTION BULLETIN	Plant & Animal Science	112	11	0	41	1	11
12	59698	The marine fish food web is globally connected	2019	Article	NATURE ECOLOGY & EVOLUTION	Plant & Animal Science	106	1	0	193	0	15
12	70371	Responses of Southern Ocean Seafloor Habitats and Communities to Global and Local Drivers of Change	2021	Review	FRONTIERS IN MARINE SCIENCE	Plant & Animal Science	96	4	0	101	0	18
12	3284	Are whale sharks exposed to persistent organic pollutants and plastic pollution in the Gulf of California (Mexico)? First ecotoxicological investigation using skin biopsies	2017	Article	COMPARATIVE BIOCHEMISTRY AND PHYSIOLOGY C-TOXICOLOGY & PHARMACOLOGY	Plant & Animal Science	93	4	0	84	1	9
12	62559	Now, you see me: High concentrations of floating plastic debris in the coastal waters of the Balearic Islands (Spain)	2018	Article	MARINE POLLUTION BULLETIN	Plant & Animal Science	60	0	0	83	0	3
12	42198	Low Abundance of Plastic Fragments in the Surface Waters of the Red Sea	2017	Article	FRONTIERS IN MARINE SCIENCE	Plant & Animal Science	51	5	0	19	0	4
12	70373	Coexistence of many species in random ecosystems	2018	Article	NATURE ECOLOGY & EVOLUTION	Plant & Animal Science	46	0	0	76	0	5
12	70383	Genomic patterns in the widespread Eurasian lynx shaped by Late Quaternary climatic fluctuations and anthropogenic impacts	2020	Article	MOLECULAR ECOLOGY	Plant & Animal Science	38	4	0	17	0	15
12	70549	The Occurrence of Paraffin and Other Petroleum Waxes in the Marine Environment: A Review of the Current Legislative Framework and Shipping Operational Practices	2018	Review	FRONTIERS IN MARINE SCIENCE	Plant & Animal Science	38	1	0	40	2	4
12	70232	When Do Morally Motivated Innovators Elicit Inspiration Instead of Irritation?	2018	Article	FRONTIERS IN PSYCHOLOGY	Psychiatry/Psychology	35	4	0	9	0	3
12	63474	Testing Scenarios to Achieve Workplace Sustainability Goals Using Backcasting and Agent-Based Modeling	2017	Article	ENVIRONMENT AND BEHAVIOR	Psychiatry/Psychology	17	2	0	1	0	7
12	31755	User perspectives in the design of interactive everyday objects for sustainable behaviour	2020	Article	INTERNATIONAL JOURNAL OF HUMAN-COMPUTER STUDIES	Psychiatry/Psychology	15	0	0	45	0	5
12	70233	Environmental Behavior in Cross-National Perspective: A Multilevel Analysis of 30 Countries	2017	Article	ENVIRONMENT AND BEHAVIOR	Psychiatry/Psychology	11	0	1	8	1	2
12	52521	Situational materialism increases climate change scepticism in men compared to women	2021	Article	JOURNAL OF EXPERIMENTAL SOCIAL PSYCHOLOGY	Psychiatry/Psychology	9	0	0	14	0	3
12	70550	Biased perception of the environmental impact of everyday behaviors	2021	Article	JOURNAL OF SOCIAL PSYCHOLOGY	Psychiatry/Psychology	8	0	0	16	0	2
12	70551	The Role of Urban/Rural Environments on Mexican Children's Connection to Nature and Pro-environmental Behavior	2020	Article	FRONTIERS IN PSYCHOLOGY	Psychiatry/Psychology	6	0	0	0	0	4
12	70552	The Mechanisms of Social Norms' Influence on Consumer Decision Making	2019	Review	ZEITSCHRIFT FUR PSYCHOLOGIE-JOURNAL OF PSYCHOLOGY	Psychiatry/Psychology	6	0	0	0	0	4
12	31644	Does Beauty Matter? The Effect of Perceived Attractiveness on Children's Moral Judgments of Harmful Actions against Animals	2021	Article	ENVIRONMENT AND BEHAVIOR	Psychiatry/Psychology	6	0	0	0	0	3
12	70553	Introducing ergonomics requirements in the eco-design of energy-related products from users' behaviour approach	2019	Article	ERGONOMICS	Psychiatry/Psychology	5	0	0	8	0	3
12	90	Is Green Growth Possible?	2019	Article	NEW POLITICAL ECONOMY	Social Sciences, General	1717	97	7	2466	4	2
12	2736	Do short-term rental platforms affect housing markets? Evidence from Airbnb in Barcelona	2020	Article	JOURNAL OF URBAN ECONOMICS	Social Sciences, General	128	3	0	130	0	4
12	27255	Carbon mitigation in domains of high consumer lock-in	2018	Article	GLOBAL ENVIRONMENTAL CHANGE-HUMAN AND POLICY DIMENSIONS	Social Sciences, General	60	3	0	57	0	8
12	70554	Agroecology prosumption: The role of CSA networks	2020	Article	JOURNAL OF RURAL STUDIES	Social Sciences, General	50	5	0	34	0	1
12	6949	Perceived fairness and public acceptability of carbon pricing: a review of the literature	2019	Review	CLIMATE POLICY	Social Sciences, General	40	0	5	22	0	3
12	4354	Scholar-activists in an expanding European food sovereignty movement*	2019	Article	JOURNAL OF PEASANT STUDIES	Social Sciences, General	36	0	0	56	0	7
12	70431	Manufacturing ignorance: think tanks, climate change and the animal-based diet	2021	Article	ENVIRONMENTAL POLITICS	Social Sciences, General	36	0	0	83	0	3
12	7076	Scientists' view s on economic growth versus the environment: a questionnaire survey among economists and non-economists	2017	Article	GLOBAL ENVIRONMENTAL CHANGE-HUMAN AND POLICY DIMENSIONS	Social Sciences, General	31	0	0	40	0	2
12	70555	Platform economies and urban planning: Airbnb and regulated deregulation in London	2018	Article	URBAN STUDIES	Social Sciences, General	28	0	0	59	0	2
12	70556	The professionalization of Airbnb in Madrid: far from a collaborative economy	2020	Article	CURRENT ISSUES IN TOURISM	Social Sciences, General	27	2	0	12	0	2
13	1023	Serious mismatches continue between science and policy in forest bioenergy	2019	Article	GLOBAL CHANGE BIOLOGY BIOENERGY	Agricultural Sciences	344	17	9	309	1	16
13	1323	How biochar works, and when it doesn't: A review of mechanisms controlling soil and plant responses to biochar	2021	Review	GLOBAL CHANGE BIOLOGY BIOENERGY	Agricultural Sciences	269	24	0	135	4	17
13	1707	The Effects of Vegetarian and Vegan Diet during Pregnancy on the Health of Mothers and Offspring	2019	Review	NUTRIENTS	Agricultural Sciences	215	21	5	127	4	10
13	1832	Climate change responses benefit from a global food system approach	2020	Editorial Material	NATURE FOOD	Agricultural Sciences	202	9	8	176	0	14
13	1885	Food systems for sustainable development: proposals for a profound four-part transformation	2018	Review	AGRONOMY FOR SUSTAINABLE DEVELOPMENT	Agricultural Sciences	197	7	12	213	2	27
13	2369	Crop cover is more important than rotational diversity for soil multifunctionality and cereal yields in European cropping systems	2021	Article	NATURE FOOD	Agricultural Sciences	155	5	0	214	0	16
13	2451	Using cover crops to mitigate and adapt to climate change. A review	2017	Review	AGRONOMY FOR SUSTAINABLE DEVELOPMENT	Agricultural Sciences	148	16	0	15	0	2
13	2471	Short- and long-term warming effects of methane may affect the cost-effectiveness of mitigation policies and benefits of low-meat diets	2021	Article	NATURE FOOD	Agricultural Sciences	147	13	0	62	1	15
13	2664	Vegan Nutrition for Mothers and Children: Practical Tools for Healthcare Providers	2019	Article	NUTRIENTS	Agricultural Sciences	133	6	0	100	2	11
13	70557	Agroforestry as a sustainable land use option to reduce wildfires risk in European Mediterranean areas	2020	Article	AGROFORESTRY SYSTEMS	Agricultural Sciences	73	6	0	16	0	13
13	2059	Adaptation to Variable Environments, Resilience to Climate Change Investigating Land, Water and Settlement in Indus Northwest India	2017	Article	CURRENT ANTHROPOLOGY	Arts & Humanities	181	20	0	37	0	15
13	2275	Patterns of change and continuity in ochre use during the late Middle Stone Age of the Horn of Africa: The Porc-Epic Cave record	2017	Article	PLOS ONE	Arts & Humanities	162	12	0	51	1	3
13	2911	Diversification, Intensification and Specialization: Changing Land Use in Western Africa from 1800 BC to AD 1500	2019	Article	JOURNAL OF WORLD PREHISTORY	Arts & Humanities	116	13	0	3	9	15
13	4141	Fire for a Reason: Barbecue at Middle Pleistocene Qesem Cave, Israel	2017	Article	CURRENT ANTHROPOLOGY	Arts & Humanities	46	2	0	15	1	4
13	4319	Teaching Responsible Research and Innovation: A Phronetic Perspective	2019	Article	SCIENCE AND ENGINEERING ETHICS	Arts & Humanities	38	0	0	79	0	13
13	4371	Phytoliths as an indicator of early modern humans plant gathering strategies, fire fuel and site occupation intensity during the Middle Stone Age at Pinnacle Point 5-6 (south coast, South Africa)	2018	Article	PLOS ONE	Arts & Humanities	34	0	0	51	2	6
13	4390	The archaeology and ethnoarchaeology of rain-fed cultivation in arid and hyper-arid North Africa	2019	Article	ANTIQUITY	Arts & Humanities	33	0	0	67	0	5
13	70558	Efficiency of gathering and its archaeological implications for an European Early Palaeolithic population	2017	Article	JOURNAL OF ANTHROPOLOGICAL ARCHAEOLOGY	Arts & Humanities	32	3	0	10	1	5
13	21315	Evidence of climate change in the lower Pleistocene site of El Kherba (Algeria) and its possible impact on hominid activities, at 1.7 Ma	2017	Article	ANTHROPOLOGIE	Arts & Humanities	25	2	0	0	0	4
13	70184	Hunting, herding, and people in the rock art of Mongolia: New discoveries in the Gobi-Altai Mountains	2021	Article	ARCHAEOLOGICAL RESEARCH IN ASIA	Arts & Humanities	22	0	0	40	0	9
13	264	Early Holocene crop cultivation and landscape modification in Amazonia	2020	Article	NATURE	Biology & Biochemistry	887	78	2	450	5	6
13	867	Intact but empty forests? Patterns of hunting-induced mammal defaunation in the tropics	2019	Article	PLOS BIOLOGY	Biology & Biochemistry	404	23	0	424	1	5
13	877	Population collapse of habitat-forming species in the Mediterranean: a long-term study of gorgonian populations affected by recurrent marine heatwaves	2021	Article	PROCEEDINGS OF THE ROYAL SOCIETY B-BIOLOGICAL SCIENCES	Biology & Biochemistry	400	52	0	188	0	22
13	1415	Antarctic ecosystems in transition - life between stresses and opportunities	2020	Article	BIOLOGICAL REVIEWS	Biology & Biochemistry	253	31	0	60	0	25
13	1649	A stony coral cell atlas illuminates the molecular and cellular basis of coral symbiosis, calcification, and immunity	2021	Article	CELL	Biology & Biochemistry	223	10	0	289	0	8
13	1736	Recent Anthropogenic Plant Extinctions Differ in Biodiversity Hotspots and Coldspots	2019	Article	CURRENT BIOLOGY	Biology & Biochemistry	212	25	0	92	0	11
13	70559	Antarctica and the strategic plan for biodiversity	2017	Article	PLOS BIOLOGY	Biology & Biochemistry	134	11	1	125	0	23
13	2678	Genomic analyses provide insights into peach local adaptation and responses to climate change	2021	Article	GENOME RESEARCH	Biology & Biochemistry	132	16	0	16	0	19
13	70560	Ecology of the collapse of Rapa Nui society	2020	Article	PROCEEDINGS OF THE ROYAL SOCIETY B-BIOLOGICAL SCIENCES	Biology & Biochemistry	124	13	0	22	0	11
13	70561	Statistical Language Backs Conservatism in Climate-Change Assessments	2019	Article	BIOSCIENCE	Biology & Biochemistry	117	8	0	74	1	4
13	2257	Viability analysis of underground mining machinery using green hydrogen as a fuel	2020	Article	INTERNATIONAL JOURNAL OF HYDROGEN ENERGY	Chemistry	164	0	0	270	0	8
13	3727	Metabolic Effects of Elevated CO2 on Wheat Grain Development and Composition	2019	Article	JOURNAL OF AGRICULTURAL AND FOOD CHEMISTRY	Chemistry	70	10	0	6	0	9
13	14038	MEDEAS: a new modeling framework integrating global biophysical and socioeconomic constraints	2020	Article	ENERGY & ENVIRONMENTAL SCIENCE	Chemistry	30	7	1	16	0	12
13	66295	Production of n-3-rich insects by bioaccumulation of fishery waste	2019	Article	JOURNAL OF FOOD COMPOSITION AND ANALYSIS	Chemistry	29	4	0	0	0	7
13	29517	Electrochemical Reduction of Carbon Dioxide to 1-Butanol on Oxide-Derived Copper	2020	Article	ANGEWANDTE CHEMIE-INTERNATIONAL EDITION	Chemistry	22	0	0	24	1	11
13	70192	The diversity of methoxyphenols released by pyrolysis-gas chromatography as predictor of soil carbon storage	2017	Article	JOURNAL OF CHROMATOGRAPHY A	Chemistry	18	2	0	5	0	5
13	70193	Life cycle assessment of animal-based foods and plant-based protein-rich alternatives: an environmental perspective	2021	Article	JOURNAL OF THE SCIENCE OF FOOD AND AGRICULTURE	Chemistry	16	1	0	9	0	8
13	29512	Origin of the Selective Electroreduction of Carbon Dioxide to Formate by Chalcogen Modified Copper	2018	Article	JOURNAL OF PHYSICAL CHEMISTRY LETTERS	Chemistry	15	0	0	39	0	6
13	70524	Light pollution offshore: Zenithal sky glow measurements in the mediterranean coastal waters	2018	Article	JOURNAL OF QUANTITATIVE SPECTROSCOPY & RADIATIVE TRANSFER	Chemistry	15	0	1	26	0	6
13	70562	From CO2 to Value-Added Products: A Review about Carbon-Based Materials for Electro-Chemical CO2 Conversion	2021	Review	CATALYSTS	Chemistry	14	0	0	20	0	4
13	210	Quantifying excess deaths related to heatwaves under climate change scenarios: A multicountry time series modelling study	2018	Article	PLOS MEDICINE	Clinical Medicine	1013	116	3	429	0	39
13	754	Health co-benefits from air pollution and mitigation costs of the Paris Agreement: a modelling study	2018	Article	LANCET PLANETARY HEALTH	Clinical Medicine	470	23	12	387	0	7
13	70198	Prioritized Research for the Prevention, Treatment, and Reversal of Chronic Disease: Recommendations From the Lifestyle Medicine Research Summit	2020	Review	FRONTIERS IN MEDICINE	Clinical Medicine	264	29	0	34	0	29
13	26319	Heart healthy cities: genetics loads the gun but the environment pulls the trigger	2021	Review	EUROPEAN HEART JOURNAL	Clinical Medicine	174	12	0	168	0	9
13	13937	The impact of heat waves on daily mortality in districts in Madrid: The effect of sociodemographic factors	2020	Article	ENVIRONMENTAL RESEARCH	Clinical Medicine	166	3	2	268	0	9
13	28155	Institutional and behaviour-change interventions to support COVID-19 public health measures: a review by the Lancet Commission Task Force on public health measures to suppress the pandemic	2021	Review	INTERNATIONAL HEALTH	Clinical Medicine	130	1	0	248	0	21
13	13723	A new integrative perspective on early warning systems for health in the context of climate change	2020	Article	ENVIRONMENTAL RESEARCH	Clinical Medicine	128	0	2	257	0	4
13	16845	Updating the Mediterranean Diet Pyramid towards Sustainability: Focus on Environmental Concerns	2020	Article	INTERNATIONAL JOURNAL OF ENVIRONMENTAL RESEARCH AND PUBLIC HEALTH	Clinical Medicine	124	1	0	165	0	15
13	2879	Envisioning planetary health in every medical curriculum: An international medical student organization's perspective	2020	Article	MEDICAL TEACHER	Clinical Medicine	118	0	1	206	0	8
13	31166	Co-benefits from sustainable dietary shifts for population and environmental health: an assessment from a large European cohort study	2021	Article	LANCET PLANETARY HEALTH	Clinical Medicine	116	3	0	139	0	36
13	4301	Mesophotic.org: a repository for scientific information on mesophotic ecosystems	2019	Article	DATABASE-THE JOURNAL OF BIOLOGICAL DATABASES AND CURATION	Computer Science	39	0	0	81	0	15
13	4432	SAT: A Software for Assessing the Risk of Desertification in Spain	2020	Article	SCIENTIFIC PROGRAMMING	Computer Science	28	0	0	37	0	4
13	62434	A review on the practice of big data analysis in agriculture	2017	Review	COMPUTERS AND ELECTRONICS IN AGRICULTURE	Computer Science	18	1	0	9	0	3
13	15302	Understanding Discussions of Citizen Science Around Sustainable Development Goals in Twitter	2021	Article	IEEE ACCESS	Computer Science	16	1	0	18	0	4
13	31755	User perspectives in the design of interactive everyday objects for sustainable behaviour	2020	Article	INTERNATIONAL JOURNAL OF HUMAN-COMPUTER STUDIES	Computer Science	15	0	0	45	0	5
13	23240	Fine scale prediction of ecological community composition using a two-step sequential Machine Learning ensemble	2021	Article	PLOS COMPUTATIONAL BIOLOGY	Computer Science	15	0	0	34	0	6
13	70200	Analysis of land use/land cover spatio-temporal metrics and population dynamics for urban growth characterization	2019	Article	COMPUTERS ENVIRONMENT AND URBAN SYSTEMS	Computer Science	11	0	0	15	0	2
13	70201	Identifying urban growth patterns through land-use/land-cover spatio-temporal metrics: Simulation and analysis	2020	Article	INTERNATIONAL JOURNAL OF GEOGRAPHICAL INFORMATION SCIENCE	Computer Science	11	0	0	19	0	2
13	70202	Estimating quality of life dimensions from urban spatial pattern metrics	2021	Article	COMPUTERS ENVIRONMENT AND URBAN SYSTEMS	Computer Science	10	0	0	15	0	5
13	70339	Hydropower production prediction using artificial neural networks: an Ecuadorian application case	2021	Article	NEURAL COMPUTING & APPLICATIONS	Computer Science	10	0	0	18	0	4
13	80	Global patterns of ecologically unequal exchange: Implications for sustainability in the 21st century	2021	Article	ECOLOGICAL ECONOMICS	Economics & Business	1792	7	0	3739	2	10
13	90	Is Green Growth Possible?	2019	Article	NEW POLITICAL ECONOMY	Economics & Business	1717	97	7	2466	4	2
13	862	Prevalence, economic contribution, and determinants of trees on farms across Sub-Saharan Africa	2017	Article	FOREST POLICY AND ECONOMICS	Economics & Business	406	271	1	18	0	3
13	1375	Guiding cities under increased droughts: The limits to sustainable urban futures	2021	Article	ECOLOGICAL ECONOMICS	Economics & Business	258	30	0	37	0	9
13	2330	Macroeconomic modelling under energy constraints: Global low carbon transition scenarios	2020	Article	ENERGY POLICY	Economics & Business	158	0	0	259	0	4
13	2365	Are the G20 economies making enough progress to meet their NDC targets?	2019	Article	ENERGY POLICY	Economics & Business	155	11	7	37	0	12
13	2460	News or social media? Socio-economic divide of mobile service consumption	2021	Article	JOURNAL OF THE ROYAL SOCIETY INTERFACE	Economics & Business	148	16	0	65	0	5
13	3536	Challenges in Assessing Public Opinion on Economic Growth Versus Environment: Considering European and US Data	2018	Article	ECOLOGICAL ECONOMICS	Economics & Business	80	1	0	116	0	3
13	3579	Five Lessons from COVID-19 for Advancing Climate Change Mitigation	2020	Article	ENVIRONMENTAL & RESOURCE ECONOMICS	Economics & Business	78	0	3	75	0	4
13	3725	Renewable Energy Cooperatives as an instrument towards the energy transition in Spain	2018	Article	ENERGY POLICY	Economics & Business	70	6	0	14	1	3
13	102	Urgent need for post-growth climate mitigation scenarios	2021	Article	NATURE ENERGY	Engineering	1586	105	0	1709	0	8
13	627	The limits of transport decarbonization under the current growth paradigm	2020	Article	ENERGY STRATEGY REVIEWS	Engineering	541	10	0	782	0	4
13	1023	Serious mismatches continue between science and policy in forest bioenergy	2019	Article	GLOBAL CHANGE BIOLOGY BIOENERGY	Engineering	344	17	9	309	1	16
13	1059	Energy investment needs for fulfilling the Paris Agreement and achieving the Sustainable Development Goals	2018	Article	NATURE ENERGY	Engineering	333	36	12	100	0	29
13	1188	Dynamic Energy Return on Energy Investment (EROI) and material requirements in scenarios of global transition to renewable energies	2019	Article	ENERGY STRATEGY REVIEWS	Engineering	298	8	0	433	0	3
13	1323	How biochar works, and when it doesn't: A review of mechanisms controlling soil and plant responses to biochar	2021	Review	GLOBAL CHANGE BIOLOGY BIOENERGY	Engineering	269	24	0	135	4	17
13	1576	Job creation during a climate compliant global energy transition across the power, heat, transport, and desalination sectors by 2050	2021	Article	ENERGY	Engineering	232	4	0	281	1	5
13	1754	Decomposing passenger transport futures: Comparing results of global integrated assessment models	2017	Article	TRANSPORTATION RESEARCH PART D-TRANSPORT AND ENVIRONMENT	Engineering	209	0	0	348	0	12
13	1808	Climate-driven variability in the occurrence of major floods across North America and Europe	2017	Article	JOURNAL OF HYDROLOGY	Engineering	204	11	0	232	0	12
13	1865	Looking under the hood: A comparison of techno-economic assumptions across national and global integrated assessment models	2019	Article	ENERGY	Engineering	199	0	0	335	0	32
13	28	Sandy coastlines under threat of erosion	2020	Article	NATURE CLIMATE CHANGE	Environment/Ecology	3121	380	7	657	2	7
13	36	Options for keeping the food system within environmental limits	2018	Article	NATURE	Environment/Ecology	2790	334	48	1676	5	23
13	80	Global patterns of ecologically unequal exchange: Implications for sustainability in the 21st century	2021	Article	ECOLOGICAL ECONOMICS	Environment/Ecology	1792	7	0	3739	2	10
13	83	Where Might We Find Ecologically Intact Communities?	2021	Article	FRONTIERS IN FORESTS AND GLOBAL CHANGE	Environment/Ecology	1755	195	0	519	9	15
13	173	Global modeling of nature's contributions to people	2019	Article	SCIENCE	Environment/Ecology	1155	37	6	1891	0	21
13	179	The social shortfall and ecological overshoot of nations	2021	Article	NATURE SUSTAINABILITY	Environment/Ecology	1129	24	0	1711	1	4
13	184	The Greenland and Antarctic ice sheets under 1.5 degrees C global warming	2018	Review	NATURE CLIMATE CHANGE	Environment/Ecology	1079	43	2	1600	4	18
13	194	Marine heatwaves threaten global biodiversity and the provision of ecosystem services	2019	Article	NATURE CLIMATE CHANGE	Environment/Ecology	1055	106	4	663	7	18
13	223	Are fieldwork studies being relegated to second place in conservation science?	2018	Article	GLOBAL ECOLOGY AND CONSERVATION	Environment/Ecology	960	1	0	1869	0	3
13	260	A multi-model analysis of long-term emissions and warming implications of current mitigation efforts	2021	Article	NATURE CLIMATE CHANGE	Environment/Ecology	893	41	0	1000	0	20
13	14	No evidence for globally coherent warm and cold periods over the preindustrial Common Era	2019	Article	NATURE	Geosciences	4190	357	0	4317	20	5
13	28	Sandy coastlines under threat of erosion	2020	Article	NATURE CLIMATE CHANGE	Geosciences	3121	380	7	657	2	7
13	66	Observed fingerprint of a weakening Atlantic Ocean overturning circulation	2018	Article	NATURE	Geosciences	1929	213	7	718	11	5
13	184	The Greenland and Antarctic ice sheets under 1.5 degrees C global warming	2018	Review	NATURE CLIMATE CHANGE	Geosciences	1079	43	2	1600	4	18
13	194	Marine heatwaves threaten global biodiversity and the provision of ecosystem services	2019	Article	NATURE CLIMATE CHANGE	Geosciences	1055	106	4	663	7	18
13	219	Permafrost is warming at a global scale	2019	Article	NATURE COMMUNICATIONS	Geosciences	993	91	3	509	2	48
13	260	A multi-model analysis of long-term emissions and warming implications of current mitigation efforts	2021	Article	NATURE CLIMATE CHANGE	Geosciences	893	41	0	1000	0	20
13	301	Climate policy implications of nonlinear decline of Arctic land permafrost and other cryosphere elements	2019	Article	NATURE COMMUNICATIONS	Geosciences	847	40	1	760	4	10
13	305	Scale and diversity of the physical technosphere: A geological perspective	2017	Article	ANTHROPOCENE REVIEW	Geosciences	843	100	0	140	2	25
13	309	A systematic review of the evidence on decoupling of GDP, resource use and GHG emissions, part II: synthesizing the insights	2020	Review	ENVIRONMENTAL RESEARCH LETTERS	Geosciences	838	40	2	1011	4	16
13	14	No evidence for globally coherent warm and cold periods over the preindustrial Common Era	2019	Article	NATURE	Global	4190	357	0	4317	20	5
13	28	Sandy coastlines under threat of erosion	2020	Article	NATURE CLIMATE CHANGE	Global	3121	380	7	657	2	7
13	36	Options for keeping the food system within environmental limits	2018	Article	NATURE	Global	2790	334	48	1676	5	23
13	66	Observed fingerprint of a weakening Atlantic Ocean overturning circulation	2018	Article	NATURE	Global	1929	213	7	718	11	5
13	80	Global patterns of ecologically unequal exchange: Implications for sustainability in the 21st century	2021	Article	ECOLOGICAL ECONOMICS	Global	1792	7	0	3739	2	10
13	83	Where Might We Find Ecologically Intact Communities?	2021	Article	FRONTIERS IN FORESTS AND GLOBAL CHANGE	Global	1755	195	0	519	9	15
13	90	Is Green Growth Possible?	2019	Article	NEW POLITICAL ECONOMY	Global	1717	97	7	2466	4	2
13	102	Urgent need for post-growth climate mitigation scenarios	2021	Article	NATURE ENERGY	Global	1586	105	0	1709	0	8
13	173	Global modeling of nature's contributions to people	2019	Article	SCIENCE	Global	1155	37	6	1891	0	21
13	179	The social shortfall and ecological overshoot of nations	2021	Article	NATURE SUSTAINABILITY	Global	1129	24	0	1711	1	4
13	46992	Air pollution and indoor settings	2021	Article	WORLD ALLERGY ORGANIZATION JOURNAL	Immunology	3	0	0	5	0	14
13	102	Urgent need for post-growth climate mitigation scenarios	2021	Article	NATURE ENERGY	Materials Science	1586	105	0	1709	0	8
13	1059	Energy investment needs for fulfilling the Paris Agreement and achieving the Sustainable Development Goals	2018	Article	NATURE ENERGY	Materials Science	333	36	12	100	0	29
13	2044	Solar conversion of CO2 to CO using Earth-abundant electrocatalysts prepared by atomic layer modification of CuO	2017	Article	NATURE ENERGY	Materials Science	182	19	0	28	0	8
13	3115	Implications of net energy-return-on-investment for a low-carbon energy transition	2018	Article	NATURE ENERGY	Materials Science	102	10	0	60	0	2
13	70404	Advances and challenges in understanding the electrocatalytic conversion of carbon dioxide to fuels	2019	Review	NATURE ENERGY	Materials Science	32	1	0	34	0	6
