ods	id	title	year	type	journal	esi	influscore	news	policy	twitter	wikipedia	authors
9	2365	Are the G20 economies making enough progress to meet their NDC targets?	2019	Article	ENERGY POLICY	Economics & Business	155	11	7	37	0	12
9	2736	Do short-term rental platforms affect housing markets? Evidence from Airbnb in Barcelona	2020	Article	JOURNAL OF URBAN ECONOMICS	Economics & Business	128	3	0	130	0	4
9	3242	Building Nations through Shared Experiences: Evidence from African Football	2020	Article	AMERICAN ECONOMIC REVIEW	Economics & Business	96	3	0	89	0	3
9	3536	Challenges in Assessing Public Opinion on Economic Growth Versus Environment: Considering European and US Data	2018	Article	ECOLOGICAL ECONOMICS	Economics & Business	80	1	0	116	0	3
9	3579	Five Lessons from COVID-19 for Advancing Climate Change Mitigation	2020	Article	ENVIRONMENTAL & RESOURCE ECONOMICS	Economics & Business	78	0	3	75	0	4
9	3725	Renewable Energy Cooperatives as an instrument towards the energy transition in Spain	2018	Article	ENERGY POLICY	Economics & Business	70	6	0	14	1	3
9	102	Urgent need for post-growth climate mitigation scenarios	2021	Article	NATURE ENERGY	Engineering	1586	105	0	1709	0	8
9	627	The limits of transport decarbonization under the current growth paradigm	2020	Article	ENERGY STRATEGY REVIEWS	Engineering	541	10	0	782	0	4
9	1059	Energy investment needs for fulfilling the Paris Agreement and achieving the Sustainable Development Goals	2018	Article	NATURE ENERGY	Engineering	333	36	12	100	0	29
9	1188	Dynamic Energy Return on Energy Investment (EROI) and material requirements in scenarios of global transition to renewable energies	2019	Article	ENERGY STRATEGY REVIEWS	Engineering	298	8	0	433	0	3
9	1576	Job creation during a climate compliant global energy transition across the power, heat, transport, and desalination sectors by 2050	2021	Article	ENERGY	Engineering	232	4	0	281	1	5
9	1754	Decomposing passenger transport futures: Comparing results of global integrated assessment models	2017	Article	TRANSPORTATION RESEARCH PART D-TRANSPORT AND ENVIRONMENT	Engineering	209	0	0	348	0	12
9	1865	Looking under the hood: A comparison of techno-economic assumptions across national and global integrated assessment models	2019	Article	ENERGY	Engineering	199	0	0	335	0	32
9	2330	Macroeconomic modelling under energy constraints: Global low carbon transition scenarios	2020	Article	ENERGY POLICY	Engineering	158	0	0	259	0	4
9	2365	Are the G20 economies making enough progress to meet their NDC targets?	2019	Article	ENERGY POLICY	Engineering	155	11	7	37	0	12
9	2768	Environmental assesment of intensive egg production: A Spanish case study	2018	Article	JOURNAL OF CLEANER PRODUCTION	Engineering	126	15	0	3	2	4
9	36	Options for keeping the food system within environmental limits	2018	Article	NATURE	Environment/Ecology	2790	334	48	1676	5	23
9	80	Global patterns of ecologically unequal exchange: Implications for sustainability in the 21st century	2021	Article	ECOLOGICAL ECONOMICS	Environment/Ecology	1792	7	0	3739	2	10
9	260	A multi-model analysis of long-term emissions and warming implications of current mitigation efforts	2021	Article	NATURE CLIMATE CHANGE	Environment/Ecology	893	41	0	1000	0	20
9	309	A systematic review of the evidence on decoupling of GDP, resource use and GHG emissions, part II: synthesizing the insights	2020	Review	ENVIRONMENTAL RESEARCH LETTERS	Environment/Ecology	838	40	2	1011	4	16
9	511	Contribution of the land sector to a 1.5 degrees C world	2019	Review	NATURE CLIMATE CHANGE	Environment/Ecology	617	47	9	694	0	20
9	616	Risk of increased food insecurity under stringent global climate change mitigation policy	2018	Article	NATURE CLIMATE CHANGE	Environment/Ecology	549	26	9	452	0	22
9	754	Health co-benefits from air pollution and mitigation costs of the Paris Agreement: a modelling study	2018	Article	LANCET PLANETARY HEALTH	Environment/Ecology	470	23	12	387	0	7
9	1016	A systematic review of the evidence on decoupling of GDP, resource use and GHG emissions, part I: bibliometric and conceptual mapping	2020	Review	ENVIRONMENTAL RESEARCH LETTERS	Environment/Ecology	346	6	0	566	3	16
9	1195	The cost of mitigation revisited	2021	Article	NATURE CLIMATE CHANGE	Environment/Ecology	295	11	1	395	0	8
9	1277	Research On Degrowth	2018	Review	ANNUAL REVIEW OF ENVIRONMENT AND RESOURCES, VOL 43	Environment/Ecology	278	19	2	288	5	6
9	260	A multi-model analysis of long-term emissions and warming implications of current mitigation efforts	2021	Article	NATURE CLIMATE CHANGE	Geosciences	893	41	0	1000	0	20
9	309	A systematic review of the evidence on decoupling of GDP, resource use and GHG emissions, part II: synthesizing the insights	2020	Review	ENVIRONMENTAL RESEARCH LETTERS	Geosciences	838	40	2	1011	4	16
9	511	Contribution of the land sector to a 1.5 degrees C world	2019	Review	NATURE CLIMATE CHANGE	Geosciences	617	47	9	694	0	20
9	616	Risk of increased food insecurity under stringent global climate change mitigation policy	2018	Article	NATURE CLIMATE CHANGE	Geosciences	549	26	9	452	0	22
9	1016	A systematic review of the evidence on decoupling of GDP, resource use and GHG emissions, part I: bibliometric and conceptual mapping	2020	Review	ENVIRONMENTAL RESEARCH LETTERS	Geosciences	346	6	0	566	3	16
9	1195	The cost of mitigation revisited	2021	Article	NATURE CLIMATE CHANGE	Geosciences	295	11	1	395	0	8
9	1299	Cost and attainability of meeting stringent climate targets without overshoot	2021	Article	NATURE CLIMATE CHANGE	Geosciences	274	22	0	195	0	40
9	1525	Residual fossil CO2 emissions in 1.5-2 degrees C pathways	2018	Article	NATURE CLIMATE CHANGE	Geosciences	239	17	7	202	2	22
9	1620	\ Comparing impacts of climate change and mitigation on global agriculture by 2050	2018	Article	ENVIRONMENTAL RESEARCH LETTERS	Geosciences	226	3	2	289	0	17
9	1824	Climate action with revenue recycling has benefits for poverty, inequality and well-being	2021	Article	NATURE CLIMATE CHANGE	Geosciences	203	10	0	210	0	15
9	36	Options for keeping the food system within environmental limits	2018	Article	NATURE	Global	2790	334	48	1676	5	23
9	80	Global patterns of ecologically unequal exchange: Implications for sustainability in the 21st century	2021	Article	ECOLOGICAL ECONOMICS	Global	1792	7	0	3739	2	10
9	90	Is Green Growth Possible?	2019	Article	NEW POLITICAL ECONOMY	Global	1717	97	7	2466	4	2
9	102	Urgent need for post-growth climate mitigation scenarios	2021	Article	NATURE ENERGY	Global	1586	105	0	1709	0	8
9	260	A multi-model analysis of long-term emissions and warming implications of current mitigation efforts	2021	Article	NATURE CLIMATE CHANGE	Global	893	41	0	1000	0	20
9	309	A systematic review of the evidence on decoupling of GDP, resource use and GHG emissions, part II: synthesizing the insights	2020	Review	ENVIRONMENTAL RESEARCH LETTERS	Global	838	40	2	1011	4	16
9	511	Contribution of the land sector to a 1.5 degrees C world	2019	Review	NATURE CLIMATE CHANGE	Global	617	47	9	694	0	20
9	616	Risk of increased food insecurity under stringent global climate change mitigation policy	2018	Article	NATURE CLIMATE CHANGE	Global	549	26	9	452	0	22
9	627	The limits of transport decarbonization under the current growth paradigm	2020	Article	ENERGY STRATEGY REVIEWS	Global	541	10	0	782	0	4
9	754	Health co-benefits from air pollution and mitigation costs of the Paris Agreement: a modelling study	2018	Article	LANCET PLANETARY HEALTH	Global	470	23	12	387	0	7
9	46992	Air pollution and indoor settings	2021	Article	WORLD ALLERGY ORGANIZATION JOURNAL	Immunology	3	0	0	5	0	14
9	102	Urgent need for post-growth climate mitigation scenarios	2021	Article	NATURE ENERGY	Materials Science	1586	105	0	1709	0	8
9	1059	Energy investment needs for fulfilling the Paris Agreement and achieving the Sustainable Development Goals	2018	Article	NATURE ENERGY	Materials Science	333	36	12	100	0	29
9	3115	Implications of net energy-return-on-investment for a low-carbon energy transition	2018	Article	NATURE ENERGY	Materials Science	102	10	0	60	0	2
9	70475	Rare Earths and the Balance Problem: How to Deal with Changing Markets?	2018	Review	JOURNAL OF SUSTAINABLE METALLURGY	Materials Science	13	0	1	14	0	4
9	62734	Geostatistical Analysis of the Spatial Correlation between Territorial Anthropization and Flooding Vulnerability: Application to the DANA Phenomenon in a Mediterranean Watershed	2021	Article	APPLIED SCIENCES-BASEL	Materials Science	10	0	0	17	0	2
9	70464	Reference Models for Digital Manufacturing Platforms	2019	Article	APPLIED SCIENCES-BASEL	Materials Science	7	0	0	8	0	4
9	70465	Digitalization of Battery Manufacturing: Current Status, Challenges, and Opportunities	2021	Review	ADVANCED ENERGY MATERIALS	Materials Science	7	0	0	11	0	5
9	70369	Toward Energy Savings in Campus Buildings under a Life Cycle Thinking Approach	2020	Article	APPLIED SCIENCES-BASEL	Materials Science	4	0	0	5	0	7
9	70210	Fluid transport within permeable pavement systems: A review of evaporation processes, moisture loss measurement and the current state of knowledge	2020	Review	CONSTRUCTION AND BUILDING MATERIALS	Materials Science	3	0	0	3	0	5
9	67206	Digital Manufacturing Platforms in the Industry 4.0 from Private and Public Perspectives	2019	Review	APPLIED SCIENCES-BASEL	Materials Science	2	0	0	4	0	4
9	4620	Growth and bubbles: Investing in human capital versus having children	2019	Article	JOURNAL OF MATHEMATICAL ECONOMICS	Mathematics	10	1	0	2	0	2
9	63965	Non-Parametric Analysis of Efficiency: An Application to the Pharmaceutical Industry	2020	Article	MATHEMATICS	Mathematics	2	0	0	2	0	2
9	62316	Trade Complementarity and the Balance of Payments Constraint Hypothesis: A New Free Trade Agreement between Mexico and South Korea	2020	Article	MATHEMATICS	Mathematics	2	0	0	3	0	4
9	70357	A stochastic dynamic model to evaluate the influence of economy and well-being on unemployment control	2018	Article	JOURNAL OF COMPUTATIONAL AND APPLIED MATHEMATICS	Mathematics	1	0	0	1	0	4
9	70214	The Quintuple Helix of Innovation Model and the SDGs: Latin-American Countries' Case and Its Forgotten Effects	2021	Article	MATHEMATICS	Mathematics	1	0	0	0	0	3
9	70476	Mergers Along the Global Supply Chain: Information Technologies and Routine Tasks	2018	Article	OXFORD BULLETIN OF ECONOMICS AND STATISTICS	Mathematics	1	0	0	1	0	2
9	70477	Analyzing the Impact of Spanish University Funding Policies on the Evolution of Their Performance: A Multi-Criteria Approach	2021	Article	MATHEMATICS	Mathematics	1	0	0	1	0	4
9	70384	Spanish strategy on bioeconomy: Towards a knowledge based sustainable innovation	2018	Review	NEW BIOTECHNOLOGY	Microbiology	14	0	2	15	0	4
9	70478	Assessing METland Design and Performance Through LCA: Techno-Environmental Study With Multifunctional Unit Perspective	2021	Article	FRONTIERS IN MICROBIOLOGY	Microbiology	7	0	0	9	0	7
9	70462	An efficient agro-industrial complex in Almeria (Spain): Towards an integrated and sustainable bioeconomy model	2018	Review	NEW BIOTECHNOLOGY	Microbiology	2	0	0	1	0	3
9	70479	Surface Micro Discharge-Cold Atmospheric Pressure Plasma Processing of Common House Cricket Acheta domesticus Powder: Antimicrobial Potential and Lipid-Quality Preservation	2021	Article	FRONTIERS IN BIOENGINEERING AND BIOTECHNOLOGY	Microbiology	1	0	0	2	0	4
9	62204	The puzzling mitochondrial phylogeography of the black soldier fly (Hermetia illucens), the commercially most important insect protein species	2020	Article	BMC EVOLUTIONARY BIOLOGY	Molecular Biology & Genetics	12	0	0	17	0	17
9	70220	Relationship in dietary habits variations during COVID-19 lockdown in Kosovo: The COVIDiet study	2021	Article	APPETITE	Neuroscience & Behavior	7	0	0	6	1	4
9	62734	Geostatistical Analysis of the Spatial Correlation between Territorial Anthropization and Flooding Vulnerability: Application to the DANA Phenomenon in a Mediterranean Watershed	2021	Article	APPLIED SCIENCES-BASEL	Physics	10	0	0	17	0	2
9	70464	Reference Models for Digital Manufacturing Platforms	2019	Article	APPLIED SCIENCES-BASEL	Physics	7	0	0	8	0	4
9	70465	Digitalization of Battery Manufacturing: Current Status, Challenges, and Opportunities	2021	Review	ADVANCED ENERGY MATERIALS	Physics	7	0	0	11	0	5
9	63638	Non-Linear Regression Modelling to Estimate the Global Warming Potential of a Newspaper	2020	Article	ENTROPY	Physics	5	0	0	8	0	3
9	70369	Toward Energy Savings in Campus Buildings under a Life Cycle Thinking Approach	2020	Article	APPLIED SCIENCES-BASEL	Physics	4	0	0	5	0	7
9	70480	The Role of Complex Analysis in Modelling Economic Growth	2018	Article	ENTROPY	Physics	4	0	0	7	0	4
9	67206	Digital Manufacturing Platforms in the Industry 4.0 from Private and Public Perspectives	2019	Review	APPLIED SCIENCES-BASEL	Physics	2	0	0	4	0	4
9	70481	Thermodynamic Rarity and Recyclability of Raw Materials in the Energy Transition: The Need for an In-Spiral Economy	2019	Article	ENTROPY	Physics	2	0	0	2	0	2
9	70474	Generating Synthetic ECGs Using GANs for Anonymizing Healthcare Data	2021	Article	ELECTRONICS	Physics	2	0	0	2	0	3
9	70482	Green Technology Fitness	2018	Article	ENTROPY	Physics	2	0	0	3	0	5
9	59698	The marine fish food web is globally connected	2019	Article	NATURE ECOLOGY & EVOLUTION	Plant & Animal Science	106	1	0	193	0	15
9	70373	Coexistence of many species in random ecosystems	2018	Article	NATURE ECOLOGY & EVOLUTION	Plant & Animal Science	46	0	0	76	0	5
9	70383	Genomic patterns in the widespread Eurasian lynx shaped by Late Quaternary climatic fluctuations and anthropogenic impacts	2020	Article	MOLECULAR ECOLOGY	Plant & Animal Science	38	4	0	17	0	15
9	70420	The spatial scaling of species interaction networks	2018	Review	NATURE ECOLOGY & EVOLUTION	Plant & Animal Science	33	0	0	63	0	8
9	70379	Choosing the right nature-based solutions to meet diverse urban challenges	2021	Article	URBAN FORESTRY & URBAN GREENING	Plant & Animal Science	29	0	0	46	0	5
9	64931	How Do Investors Value Firms' Decisions on Obtaining an Eco-label? Evidence from the Fishing Industry	2021	Article	MARINE RESOURCE ECONOMICS	Plant & Animal Science	28	3	0	4	0	3
9	70421	LIFE BEEF CARBON: a common framework for quantifying grass and corn based beef farms' carbon footprints	2020	Article	ANIMAL	Plant & Animal Science	21	1	0	14	0	9
9	70422	Organic Farming as a Strategy to Reduce Carbon Footprint in Dehesa Agroecosystems: A Case Study Comparing Different Livestock Products	2020	Article	ANIMALS	Plant & Animal Science	18	2	0	4	0	3
9	62204	The puzzling mitochondrial phylogeography of the black soldier fly (Hermetia illucens), the commercially most important insect protein species	2020	Article	BMC EVOLUTIONARY BIOLOGY	Plant & Animal Science	12	0	0	17	0	17
9	70483	The Management of Agricultural Waste Biomass in the Framework of Circular Economy and Bioeconomy: An Opportunity for Greenhouse Agriculture in Southeast Spain	2020	Article	AGRONOMY-BASEL	Plant & Animal Science	11	1	0	1	0	4
9	70484	What drives future business leaders? How work values and gender shape young adults' entrepreneurial and leadership aspirations	2018	Article	JOURNAL OF VOCATIONAL BEHAVIOR	Psychiatry/Psychology	21	3	0	0	0	4
9	70426	Blockchain technologies to address smart city and society challenges	2021	Article	COMPUTERS IN HUMAN BEHAVIOR	Psychiatry/Psychology	11	0	0	17	0	4
9	70485	Women Entrepreneurship: A Systematic Review to Outline the Boundaries of Scientific Literature	2020	Review	FRONTIERS IN PSYCHOLOGY	Psychiatry/Psychology	10	1	0	0	0	3
9	70486	An Empiric Experience Implementing a Methodology to Improve the Entrepreneurial Support System: Creating Social Value Through Collaboration and Co-creation	2021	Article	FRONTIERS IN PSYCHOLOGY	Psychiatry/Psychology	10	0	0	16	0	3
9	70487	Who Counts Where? COVID-19 Surveillance in Federal Countries	2021	Article	JOURNAL OF HEALTH POLITICS POLICY AND LAW	Psychiatry/Psychology	9	1	0	10	0	5
9	70488	Applying the social cognitive model of career self-management to the entrepreneurial career decision: The role of exploratory and coping adaptive behaviours	2019	Article	JOURNAL OF VOCATIONAL BEHAVIOR	Psychiatry/Psychology	8	0	0	10	0	3
9	70489	The trade-off between equity and efficiency in population health gain: Making it real	2018	Article	SOCIAL SCIENCE & MEDICINE	Psychiatry/Psychology	7	0	0	13	0	4
9	70490	The dark side of the sharing economy: Balancing value co-creation and value co-destruction	2020	Article	PSYCHOLOGY & MARKETING	Psychiatry/Psychology	4	0	0	9	0	3
9	70491	The Economic and Social Value of Science and Technology Parks. The Case of Tecnocampus	2020	Article	FRONTIERS IN PSYCHOLOGY	Psychiatry/Psychology	4	0	0	4	0	3
9	70492	Exploring the Social and Solidarity Economy Sector in Greece, Spain, and Switzerland in Times of Crisis	2018	Article	AMERICAN BEHAVIORAL SCIENTIST	Psychiatry/Psychology	3	0	0	0	2	3
9	90	Is Green Growth Possible?	2019	Article	NEW POLITICAL ECONOMY	Social Sciences, General	1717	97	7	2466	4	2
9	2736	Do short-term rental platforms affect housing markets? Evidence from Airbnb in Barcelona	2020	Article	JOURNAL OF URBAN ECONOMICS	Social Sciences, General	128	3	0	130	0	4
9	3145	Exploring the gender gap in the Spanish Wikipedia: Differences in engagement and editing practices	2021	Article	PLOS ONE	Social Sciences, General	101	8	0	80	1	5
9	3855	Big plant closures and local employment	2018	Article	JOURNAL OF ECONOMIC GEOGRAPHY	Social Sciences, General	63	6	0	24	0	3
9	27255	Carbon mitigation in domains of high consumer lock-in	2018	Article	GLOBAL ENVIRONMENTAL CHANGE-HUMAN AND POLICY DIMENSIONS	Social Sciences, General	60	3	0	57	0	8
9	70428	Beyond shared socioeconomic pathways (SSPs) and representative concentration pathways (RCPs): climate policy implementation scenarios for Europe, the US and China	2020	Article	CLIMATE POLICY	Social Sciences, General	49	0	0	92	0	4
9	70429	Making the Paris Agreement: Historical Processes and the Drivers of Institutional Design	2021	Article	POLITICAL STUDIES	Social Sciences, General	44	0	0	119	0	6
9	6949	Perceived fairness and public acceptability of carbon pricing: a review of the literature	2019	Review	CLIMATE POLICY	Social Sciences, General	40	0	5	22	0	3
9	4284	Inequality and education in pre-industrial economies: Evidence from Spain	2018	Article	EXPLORATIONS IN ECONOMIC HISTORY	Social Sciences, General	40	0	0	48	0	2
9	4303	Inequality and city size: An analysis for OECD functional urban areas	2020	Article	PAPERS IN REGIONAL SCIENCE	Social Sciences, General	39	3	0	26	0	3
10	70148	Income elasticities for food, calories and nutrients across Africa: A meta-analysis	2018	Article	FOOD POLICY	Agricultural Sciences	29	0	2	24	0	6
10	6700	Deprivation Index and Lifestyle: Baseline Cross-Sectional Analysis of the PREDIMED-Plus Catalonia Study	2021	Article	NUTRIENTS	Agricultural Sciences	10	0	0	19	0	9
10	66759	The Digitalization of the European Agri-Food Cooperative Sector. Determining Factors to Embrace Information and Communication Technologies	2021	Article	AGRICULTURE-BASEL	Agricultural Sciences	7	0	0	15	0	3
10	67239	Mediterranean Diet, Psychological Adjustment and Health Perception in University Students: The Mediating Effect of Healthy and Unhealthy Food Groups	2021	Article	NUTRIENTS	Agricultural Sciences	4	0	0	4	0	5
10	69281	Economic crisis and the unemployment effect on household food expenditure: The case of Spain	2017	Article	FOOD POLICY	Agricultural Sciences	1	0	0	1	0	3
10	70493	Association between Depression, Lifestyles, Sleep Quality, and Sense of Coherence in a Population with Cardiovascular Risk	2021	Article	NUTRIENTS	Agricultural Sciences	1	0	0	2	0	6
10	70494	A Multifaceted Explanation of the Predisposition to Buy Organic Food	2020	Article	FOODS	Agricultural Sciences	1	0	0	5	0	4
10	256	Failing victims, fuelling hate: challenging the harms of the 'Muslim grooming gangs' narrative	2020	Article	RACE & CLASS	Arts & Humanities	897	4	0	1724	14	2
10	64671	Neonatal discrimination and excess female mortality in childhood in Spain in the first half of the twentieth century	2021	Article	CLIOMETRICA	Arts & Humanities	21	1	0	2	0	1
10	70288	The use of past events as political symbols in Spain. The example of Vox and the need for a new archaeology of ethnicity	2021	Article	INTERNATIONAL JOURNAL OF HERITAGE STUDIES	Arts & Humanities	19	0	0	26	0	2
10	70435	Origins of regional divergence: economic growth in socialist Yugoslavia dagger	2020	Article	ECONOMIC HISTORY REVIEW	Arts & Humanities	16	0	0	28	0	1
10	47372	Religious discrimination in young Muslim assimilation in Spain: Contributions to Portes and Rumbaut's segmented assimilation theory	2020	Article	SOCIAL COMPASS	Arts & Humanities	10	0	0	13	0	1
10	70495	Ethnic residential segregation among seasonal migrant workers: from temporary tents to new rural ghettos in southern Turkey	2020	Article	JOURNAL OF PEASANT STUDIES	Arts & Humanities	9	0	0	14	0	1
10	70496	You are just being emotional! Testimonial injustice and folk-psychological attributions	2019	Article	SYNTHESE	Arts & Humanities	8	0	0	10	0	2
10	62523	Collaboration matters: capacity building, up-scaling, spreading, and sustainability in citizen-generated data projects	2021	Article	HUMANITIES & SOCIAL SCIENCES COMMUNICATIONS	Arts & Humanities	8	0	0	10	0	4
10	70436	EDUCATIONAL DISPARITIES IN COLOMBIA 1904-58: NEW EVIDENCE FROM A REGIONAL LEVEL APPROACH	2019	Article	REVISTA DE HISTORIA ECONOMICA	Arts & Humanities	7	0	0	9	0	1
10	70497	Analysis of gender, age and disability representation in music education textbooks: A research update	2018	Article	INTERNATIONAL JOURNAL OF MUSIC EDUCATION	Arts & Humanities	5	0	0	5	0	2
10	63687	Mycobacterium leprae diversity and population dynamics in medieval Europe from novel ancient genomes	2021	Article	BMC BIOLOGY	Biology & Biochemistry	54	1	0	69	1	39
10	70155	Drivers of sex ratio bias in the eastern bongo: lower inbreeding increases the probability of being born male	2019	Article	PROCEEDINGS OF THE ROYAL SOCIETY B-BIOLOGICAL SCIENCES	Biology & Biochemistry	7	0	0	16	0	3
10	70440	Low birthweight prevalence among Spanish women during the economic crisis: differences by parity	2020	Article	ANNALS OF HUMAN BIOLOGY	Biology & Biochemistry	1	0	0	0	0	5
10	70498	A Framework to Understand Attitudes towards Immigration through Twitter	2021	Article	APPLIED SCIENCES-BASEL	Chemistry	11	0	1	15	0	3
10	70258	On Simulating the Propagation and Countermeasures of Hate Speech in Social Networks	2021	Article	APPLIED SCIENCES-BASEL	Chemistry	1	0	0	1	0	2
10	487	Socioeconomic status, life expectancy and mortality in a universal healthcare setting: An individual-level analysis of > 6 million Catalan residents	2019	Article	PREVENTIVE MEDICINE	Clinical Medicine	635	1	0	1046	0	7
10	500	The threat of home eviction and its effects on health through the equity lens: A systematic review	2017	Review	SOCIAL SCIENCE & MEDICINE	Clinical Medicine	624	73	3	108	0	6
10	21978	The burden of disease in Greece, health loss, risk factors, and health financing, 2000-16: an analysis of the Global Burden of Disease Study 2016	2018	Article	LANCET PUBLIC HEALTH	Clinical Medicine	252	4	6	304	0	47
10	70259	Sex differences in mortality: results from a population-based study of 12 longitudinal cohorts	2021	Article	CANADIAN MEDICAL ASSOCIATION JOURNAL	Clinical Medicine	237	31	0	33	0	9
10	70156	Hair cortisol levels in pregnancy as a possible determinant of fetal sex: a longitudinal study	2021	Article	JOURNAL OF DEVELOPMENTAL ORIGINS OF HEALTH AND DISEASE	Clinical Medicine	201	26	0	13	0	5
10	14409	Lack of Social Support and Its Role on Self-Perceived Health in a Representative Sample of Spanish Adults. Another Aspect of Gender Inequality	2021	Article	JOURNAL OF CLINICAL MEDICINE	Clinical Medicine	153	23	0	1	0	11
10	70499	Gender as a determinant of mental health and its medicalization. SESPAS Report 2020	2020	Review	GACETA SANITARIA	Clinical Medicine	124	14	0	18	0	4
10	70443	A lesson from history? Worsening mortality and the rise of the Nazi Party in 1930s Germany	2021	Article	PUBLIC HEALTH	Clinical Medicine	118	12	0	33	0	5
10	70500	Trends in health inequalities in 27 European countries	2018	Article	PROCEEDINGS OF THE NATIONAL ACADEMY OF SCIENCES OF THE UNITED STATES OF AMERICA	Clinical Medicine	97	5	6	118	0	19
10	70501	Multimorbidity and chronic diseases among undocumented migrants: evidence to contradict the myths	2020	Article	INTERNATIONAL JOURNAL FOR EQUITY IN HEALTH	Clinical Medicine	84	0	0	129	0	6
10	4322	Evaluating gender equality effects in research and innovation systems	2020	Article	SCIENTOMETRICS	Computer Science	38	1	0	47	0	4
10	4414	Pandemic programming How COVID-19 affects software developers and how their organizations can help	2020	Article	EMPIRICAL SOFTWARE ENGINEERING	Computer Science	31	0	1	39	0	17
10	66061	Analysis of the Evolution of the Spanish Labour Market Through Unsupervised Learning	2019	Article	IEEE ACCESS	Computer Science	7	1	0	0	0	5
10	70296	Crediting pull requests to open source research software as an academic contribution	2021	Article	JOURNAL OF COMPUTATIONAL SCIENCE	Computer Science	7	0	0	8	0	3
10	70163	On measuring the sources of changes in poverty using the Shapley method. An application to Europe	2020	Article	FUZZY SETS AND SYSTEMS	Computer Science	1	0	0	3	0	2
10	769	Rising between-workplace inequalities in high-income countries	2020	Article	PROCEEDINGS OF THE NATIONAL ACADEMY OF SCIENCES OF THE UNITED STATES OF AMERICA	Economics & Business	457	40	0	193	0	27
10	1433	Toward understanding the impact of artificial intelligence on labor	2019	Article	PROCEEDINGS OF THE NATIONAL ACADEMY OF SCIENCES OF THE UNITED STATES OF AMERICA	Economics & Business	251	7	4	408	4	13
10	1687	Wage inequality and poverty effects of lockdown and social distancing in Europe	2020	Article	EUROPEAN ECONOMIC REVIEW	Economics & Business	218	25	0	37	0	3
10	2218	Universal resilience patterns in labor markets	2021	Article	NATURE COMMUNICATIONS	Economics & Business	168	8	0	205	0	6
10	2881	Challenging the working time reduction and wages trade-off: a simulation for the Spanish economy	2021	Article	CAMBRIDGE JOURNAL OF ECONOMICS	Economics & Business	118	5	0	97	0	2
