ods	id	title	year	type	journal	esi	influscore	news	policy	twitter	wikipedia	authors
5	9985	Physical chronic conditions, multimorbidity and sedentary behavior amongst middle-aged and older adults in six low- and middle-income countries	2017	Article	INTERNATIONAL JOURNAL OF BEHAVIORAL NUTRITION AND PHYSICAL ACTIVITY	Biology & Biochemistry	66	6	0	41	0	3
5	9987	Sedentary behavior and depressive symptoms among 67,077 adolescents aged 12-15 years from 30 low- and middle-income countries	2018	Article	INTERNATIONAL JOURNAL OF BEHAVIORAL NUTRITION AND PHYSICAL ACTIVITY	Biology & Biochemistry	60	0	0	92	0	5
5	5459	Serum 25-hydroxyvitamin D and breast cancer risk by pathological subtype (MCC-Spain)	2018	Article	JOURNAL OF STEROID BIOCHEMISTRY AND MOLECULAR BIOLOGY	Biology & Biochemistry	58	8	0	4	0	20
5	9963	Chronic physical conditions, multimorbidity and physical activity across 46 low- and middle-income countries	2017	Article	INTERNATIONAL JOURNAL OF BEHAVIORAL NUTRITION AND PHYSICAL ACTIVITY	Biology & Biochemistry	54	0	0	113	0	9
5	63687	Mycobacterium leprae diversity and population dynamics in medieval Europe from novel ancient genomes	2021	Article	BMC BIOLOGY	Biology & Biochemistry	54	1	0	69	1	39
5	70292	Revisiting the role of protein-induced satiation and satiety	2017	Article	FOOD HYDROCOLLOIDS	Chemistry	63	15	0	4	0	2
5	27205	Nutrition and Cardiovascular Health	2018	Review	INTERNATIONAL JOURNAL OF MOLECULAR SCIENCES	Chemistry	44	5	0	5	0	4
5	67937	Prediction of Labor Induction Success from the Uterine Electrohysterogram	2019	Article	JOURNAL OF SENSORS	Chemistry	25	3	0	1	0	7
5	64405	Brassica Bioactives Could Ameliorate the Chronic Inflammatory Condition of Endometriosis	2020	Review	INTERNATIONAL JOURNAL OF MOLECULAR SCIENCES	Chemistry	24	1	0	23	0	7
5	62636	m-SFT: A Novel Mobile Health System to Assess the Elderly Physical Condition	2020	Article	SENSORS	Chemistry	21	2	0	9	0	5
5	70293	Nationwide Study of Drug Resistance Mutations in HIV-1 Infected Individuals under Antiretroviral Therapy in Brazil	2021	Article	INTERNATIONAL JOURNAL OF MOLECULAR SCIENCES	Chemistry	18	1	0	10	0	8
5	62731	Mortality of NBA Players: Risk Factors and Comparison with the General US Population	2019	Article	APPLIED SCIENCES-BASEL	Chemistry	16	1	0	15	0	4
5	66673	Antimicrobial Face Shield: Next Generation of Facial Protective Equipment against SARS-CoV-2 and Multidrug-Resistant Bacteria	2021	Article	INTERNATIONAL JOURNAL OF MOLECULAR SCIENCES	Chemistry	12	1	0	5	0	6
5	70294	Approaching Sex Differences in Cardiovascular Non-Coding RNA Research	2020	Review	INTERNATIONAL JOURNAL OF MOLECULAR SCIENCES	Chemistry	8	0	0	12	0	10
5	43416	Intensity of Physical Activity in Physical Education Classes and School Recesses and Its Associations with Body Mass Index and Global Fitness Score in Spanish Schoolchildren	2021	Article	APPLIED SCIENCES-BASEL	Chemistry	7	0	0	9	0	8
5	11	Unprocessed Red Meat and Processed Meat Consumption: Dietary Guideline Recommendations From the Nutritional Recommendations (NutriRECS) Consortium	2019	Article	ANNALS OF INTERNAL MEDICINE	Clinical Medicine	4513	511	0	3215	7	19
5	53	Vitamin D Status in Hospitalized Patients with SARS-CoV-2 Infection	2021	Article	JOURNAL OF CLINICAL ENDOCRINOLOGY & METABOLISM	Clinical Medicine	2184	173	0	2104	1	12
5	69	Primary Prevention of Cardiovascular Disease with a Mediterranean Diet Supplemented with Extra-Virgin Olive Oil or Nuts	2018	Article	NEW ENGLAND JOURNAL OF MEDICINE	Clinical Medicine	1900	184	1	1249	0	21
5	70	The associations of major foods and fibre with risks of ischaemic and haemorrhagic stroke: a prospective study of 418 329 participants in the EPIC cohort across nine European countries	2020	Article	EUROPEAN HEART JOURNAL	Clinical Medicine	1894	233	1	316	0	40
5	81	Differences of energy expenditure while sitting versus standing: A systematic review and meta-analysis	2018	Review	EUROPEAN JOURNAL OF PREVENTIVE CARDIOLOGY	Clinical Medicine	1767	228	0	360	0	7
5	93	Effect of Exercise Intervention on Functional Decline in Very Elderly Patients During Acute Hospitalization A Randomized Clinical Trial	2019	Article	JAMA INTERNAL MEDICINE	Clinical Medicine	1686	19	0	3212	0	14
5	129	Characterisation of the first 250 000 hospital admissions for COVID-19 in Brazil: a retrospective analysis of nationwide data	2021	Article	LANCET RESPIRATORY MEDICINE	Clinical Medicine	1394	38	0	2184	0	7
5	195	Aspirin versus Placebo in Pregnancies at High Risk for Preterm Preeclampsia	2017	Article	NEW ENGLAND JOURNAL OF MEDICINE	Clinical Medicine	1051	57	1	1159	0	20
5	208	Gender gap in journal submissions and peer review during the first wave of the COVID-19 pandemic. A study on 2329 Elsevier journals	2021	Article	PLOS ONE	Clinical Medicine	1023	20	0	1568	0	6
5	280	Is urinary incontinence associated with sedentary behaviour in older women? Analysis of data from the National Health and Nutrition Examination Survey	2020	Article	PLOS ONE	Clinical Medicine	866	109	0	4	0	6
5	4322	Evaluating gender equality effects in research and innovation systems	2020	Article	SCIENTOMETRICS	Computer Science	38	1	0	47	0	4
5	4414	Pandemic programming How COVID-19 affects software developers and how their organizations can help	2020	Article	EMPIRICAL SOFTWARE ENGINEERING	Computer Science	31	0	1	39	0	17
5	13077	linus: Conveniently explore, share, and present large-scale biological trajectory data in a web browser	2021	Article	PLOS COMPUTATIONAL BIOLOGY	Computer Science	16	0	0	34	0	7
5	70295	Non-small-cell lung cancer classification via RNA-Seq and histology imaging probability fusion	2021	Article	BMC BIOINFORMATICS	Computer Science	14	0	0	25	0	7
5	18055	Breast MRI and X-ray mammography registration using gradient values	2019	Article	MEDICAL IMAGE ANALYSIS	Computer Science	8	0	0	10	0	8
5	70296	Crediting pull requests to open source research software as an academic contribution	2021	Article	JOURNAL OF COMPUTATIONAL SCIENCE	Computer Science	7	0	0	8	0	3
5	8445	Determining the likely place of HIV acquisition for migrants in Europe combining subject-specific information and biomarkers data	2019	Article	STATISTICAL METHODS IN MEDICAL RESEARCH	Computer Science	5	0	0	5	0	201
5	70297	ATOPE plus : An mHealth System to Support Personalized Therapeutic Exercise Interventions in Patients With Cancer	2021	Article	IEEE ACCESS	Computer Science	5	0	0	6	0	7
5	70298	A review of AI and Data Science support for cancer management	2021	Review	ARTIFICIAL INTELLIGENCE IN MEDICINE	Computer Science	5	0	0	11	0	10
5	70299	Robust estimation of infant feeding indicators by data quality assessment of longitudinal electronic health records from birth up to 18 months of life	2021	Article	COMPUTER METHODS AND PROGRAMS IN BIOMEDICINE	Computer Science	4	0	0	7	0	6
5	412	Who do we invent for? Patents by women focus more on women's health, but few women get to invent	2021	Article	SCIENCE	Economics & Business	708	70	1	334	0	3
5	1954	Intimate partner violence under forced cohabitation and economic stress: Evidence from the COVID-19 pandemic	2021	Article	JOURNAL OF PUBLIC ECONOMICS	Economics & Business	191	19	0	70	0	3
5	3084	Keeping inequality at home: The genesis of gender roles in housework	2019	Article	LABOUR ECONOMICS	Economics & Business	104	4	0	102	0	3
5	3374	Economics of mental well-being: a prospective study estimating associated health care costs and sickness benefit transfers in Denmark	2021	Article	EUROPEAN JOURNAL OF HEALTH ECONOMICS	Economics & Business	89	8	0	37	0	12
5	3786	The impact of sex education mandates on teenage pregnancy: International evidence	2020	Article	HEALTH ECONOMICS	Economics & Business	67	1	0	61	0	3
5	4182	Child marriage and infant mortality: causal evidence from Ethiopia	2021	Article	JOURNAL OF POPULATION ECONOMICS	Economics & Business	45	0	0	69	0	1
5	4273	Long run educational and spillover effects of unconditional cash transfers: Evidence from South Africa	2020	Article	ECONOMICS & HUMAN BIOLOGY	Economics & Business	41	3	1	19	0	2
5	4268	THE HEALTH TOLL OF IMPORT COMPETITION	2020	Article	ECONOMIC JOURNAL	Economics & Business	41	4	0	3	0	2
5	4305	Work, Care and Gender during the COVID-19 Crisis*	2020	Article	FISCAL STUDIES	Economics & Business	39	2	2	17	0	2
5	58571	Too family friendly? The consequences of parent part-time working rights	2021	Article	JOURNAL OF PUBLIC ECONOMICS	Economics & Business	34	0	0	34	0	2
5	2695	Working conditions and health in Spain during the COVID-19 pandemic: Minding the gap	2021	Article	SAFETY SCIENCE	Engineering	131	0	0	178	0	4
5	3453	Green streetscape and walking: Exploring active mobility patterns in dense and compact cities	2019	Article	JOURNAL OF TRANSPORT & HEALTH	Engineering	85	6	0	57	1	3
5	3723	European cyclists' travel behavior: Differences and similarities between seven European (PASTA) cities	2018	Article	JOURNAL OF TRANSPORT & HEALTH	Engineering	70	1	0	114	0	20
5	59067	Impacts of study design on sample size, participation bias, and outcome measurement: A case study from bicycling research	2019	Article	JOURNAL OF TRANSPORT & HEALTH	Engineering	29	0	0	61	1	10
5	67949	Electrohysterographic characterization of the uterine myoelectrical response to labor induction drugs	2018	Article	MEDICAL ENGINEERING & PHYSICS	Engineering	25	3	0	1	0	7
5	67937	Prediction of Labor Induction Success from the Uterine Electrohysterogram	2019	Article	JOURNAL OF SENSORS	Engineering	25	3	0	1	0	7
5	62636	m-SFT: A Novel Mobile Health System to Assess the Elderly Physical Condition	2020	Article	SENSORS	Engineering	21	2	0	9	0	5
5	62731	Mortality of NBA Players: Risk Factors and Comparison with the General US Population	2019	Article	APPLIED SCIENCES-BASEL	Engineering	16	1	0	15	0	4
5	70300	Change-point of multiple biomarkers in women with ovarian cancer	2017	Article	BIOMEDICAL SIGNAL PROCESSING AND CONTROL	Engineering	14	2	0	0	0	10
5	70268	Variables that predict burnout in professional drivers	2021	Article	INTERNATIONAL JOURNAL OF OCCUPATIONAL SAFETY AND ERGONOMICS	Engineering	14	3	0	0	0	5
5	63510	Gender Identity: The Human Right of Depathologization	2019	Editorial Material	INTERNATIONAL JOURNAL OF ENVIRONMENTAL RESEARCH AND PUBLIC HEALTH	Environment/Ecology	218	23	1	27	1	7
5	13779	Heat wave and the risk of intimate partner violence	2018	Article	SCIENCE OF THE TOTAL ENVIRONMENT	Environment/Ecology	171	20	1	81	0	6
5	19667	Residential surrounding greenspace and age at menopause: A 20-year European study (ECRHS)	2019	Article	ENVIRONMENT INTERNATIONAL	Environment/Ecology	158	22	0	10	0	20
5	58304	A discourse analysis of yellow-vest resistance against carbon taxes	2021	Article	ENVIRONMENTAL INNOVATION AND SOCIETAL TRANSITIONS	Environment/Ecology	135	5	0	164	0	3
5	62930	Social Media, Thin-Ideal, Body Dissatisfaction and Disordered Eating Attitudes: An Exploratory Analysis	2019	Article	INTERNATIONAL JOURNAL OF ENVIRONMENTAL RESEARCH AND PUBLIC HEALTH	Environment/Ecology	132	24	0	10	0	6
5	65122	Solar ultraviolet doses and vitamin D in a northern mid-latitude	2017	Article	SCIENCE OF THE TOTAL ENVIRONMENT	Environment/Ecology	123	14	0	21	0	4
5	55901	Persistent gender bias in marine science and conservation calls for action to achieve equity	2021	Article	BIOLOGICAL CONSERVATION	Environment/Ecology	123	0	0	217	0	11
5	34208	Physical Activity, Sedentary Behavior, Sleep and Self-Regulation in Spanish Preschoolers during the COVID-19 Lockdown	2021	Article	INTERNATIONAL JOURNAL OF ENVIRONMENTAL RESEARCH AND PUBLIC HEALTH	Environment/Ecology	114	4	0	131	0	5
5	8338	Urban environment during early-life and blood pressure in young children	2021	Article	ENVIRONMENT INTERNATIONAL	Environment/Ecology	103	13	0	26	0	16
5	70301	To advance sustainable stewardship, we must document not only biodiversity but geodiversity	2019	Editorial Material	PROCEEDINGS OF THE NATIONAL ACADEMY OF SCIENCES OF THE UNITED STATES OF AMERICA	Environment/Ecology	100	6	0	147	1	29
5	1143	Climate change facilitated the early colonization of the Azores medieval times	2021	Article	PROCEEDINGS OF THE NATIONAL ACADEMY OF SCIENCES OF THE UNITED STATES OF AMERICA	Geosciences	310	32	0	113	3	32
5	26228	Impact of a riverside accessibility intervention on use, physical activity, and wellbeing: A mixed methods pre-post evaluation	2019	Article	LANDSCAPE AND URBAN PLANNING	Geosciences	12	0	0	11	1	9
5	70271	Women in Geosciences Preface	2020	Editorial Material	CATENA	Geosciences	6	0	0	8	0	2
5	70302	Enhancing the Role of Geoconservation in Protected Area Management and Nature Conservation	2018	Article	GEOHERITAGE	Geosciences	1	0	0	0	0	4
5	70303	Assessment of Geodiversity in the Southern Part of the Central Iberian Zone (Jaen Province): Usefulness for Delimiting and Managing Natural Protected Areas	2020	Article	GEOHERITAGE	Geosciences	1	0	0	1	0	4
5	11	Unprocessed Red Meat and Processed Meat Consumption: Dietary Guideline Recommendations From the Nutritional Recommendations (NutriRECS) Consortium	2019	Article	ANNALS OF INTERNAL MEDICINE	Global	4513	511	0	3215	7	19
5	53	Vitamin D Status in Hospitalized Patients with SARS-CoV-2 Infection	2021	Article	JOURNAL OF CLINICAL ENDOCRINOLOGY & METABOLISM	Global	2184	173	0	2104	1	12
5	63	Association of changes in red meat consumption with total and cause specific mortality among US women and men: two prospective cohort studies	2019	Article	BMJ-BRITISH MEDICAL JOURNAL	Global	2021	225	0	970	1	8
5	68	Fried potato consumption is associated with elevated mortality: an 8-y longitudinal cohort study	2017	Article	AMERICAN JOURNAL OF CLINICAL NUTRITION	Global	1909	242	0	723	1	12
5	69	Primary Prevention of Cardiovascular Disease with a Mediterranean Diet Supplemented with Extra-Virgin Olive Oil or Nuts	2018	Article	NEW ENGLAND JOURNAL OF MEDICINE	Global	1900	184	1	1249	0	21
5	70	The associations of major foods and fibre with risks of ischaemic and haemorrhagic stroke: a prospective study of 418 329 participants in the EPIC cohort across nine European countries	2020	Article	EUROPEAN HEART JOURNAL	Global	1894	233	1	316	0	40
5	81	Differences of energy expenditure while sitting versus standing: A systematic review and meta-analysis	2018	Review	EUROPEAN JOURNAL OF PREVENTIVE CARDIOLOGY	Global	1767	228	0	360	0	7
5	92	Healthy dietary indices and risk of depressive outcomes: a systematic review and meta-analysis of observational studies	2019	Review	MOLECULAR PSYCHIATRY	Global	1713	248	1	442	2	7
5	93	Effect of Exercise Intervention on Functional Decline in Very Elderly Patients During Acute Hospitalization A Randomized Clinical Trial	2019	Article	JAMA INTERNAL MEDICINE	Global	1686	19	0	3212	0	14
5	108	Long-acting intramuscular cabotegravir and rilpivirine in adults with HIV-1 infection (LATTE-2): 96-week results of a randomised, open-label, phase 2b, non-inferiority trial	2017	Article	LANCET	Global	1533	165	0	641	1	24
5	108	Long-acting intramuscular cabotegravir and rilpivirine in adults with HIV-1 infection (LATTE-2): 96-week results of a randomised, open-label, phase 2b, non-inferiority trial	2017	Article	LANCET	Immunology	1533	165	0	641	1	24
5	970	Long-acting cabotegravir and rilpivirine dosed every 2 months in adults with HIV-1 infection (ATLAS-2M), 48-week results: a randomised, multicentre, open-label, phase 3b, non-inferiority study	2020	Article	LANCET	Immunology	361	43	0	164	0	28
5	1098	Myalgic Encephalomyelitis/Chronic Fatigue Syndrome - Evidence for an autoimmune disease	2018	Review	AUTOIMMUNITY REVIEWS	Immunology	322	13	0	426	2	7
5	1180	Long-Acting Cabotegravir and Rilpivirine after Oral Induction for HIV-1 Infection	2020	Article	NEW ENGLAND JOURNAL OF MEDICINE	Immunology	300	34	0	98	2	27
5	1210	Group B Streptococcal Disease Worldwide for Pregnant Women, Stillbirths, and Children: Why, What, and How to Undertake Estimates?	2017	Article	CLINICAL INFECTIOUS DISEASES	Immunology	291	43	1	45	0	21
5	1255	Long-Acting Cabotegravir and Rilpivirine for Maintenance of HIV-1 Suppression	2020	Article	NEW ENGLAND JOURNAL OF MEDICINE	Immunology	282	37	0	60	0	27
5	1615	Epstein-Barr Virus and the Origin of Myalgic Encephalomyelitis or Chronic Fatigue Syndrome	2021	Review	FRONTIERS IN IMMUNOLOGY	Immunology	227	12	0	260	0	5
5	2995	Estimates of the Burden of Group B Streptococcal Disease Worldwide for Pregnant Women, Stillbirths, and Children	2017	Article	CLINICAL INFECTIOUS DISEASES	Immunology	109	12	2	33	2	23
5	52361	Effectiveness of HPV vaccines against genital warts in women from Valencia, Spain	2017	Article	VACCINE	Immunology	77	0	1	152	0	5
5	65934	Prevalence of and Risk Factors for Anal High-grade Squamous Intraepithelial Lesions in Women Living with Human Immunodeficiency Virus	2020	Article	CLINICAL INFECTIOUS DISEASES	Immunology	69	11	0	1	0	19
5	62731	Mortality of NBA Players: Risk Factors and Comparison with the General US Population	2019	Article	APPLIED SCIENCES-BASEL	Materials Science	16	1	0	15	0	4
5	70304	Development of pH-sensitive vaginal films based on methacrylate copolymers for topical HIV-1 pre-exposure prophylaxis	2021	Article	ACTA BIOMATERIALIA	Materials Science	10	0	0	14	0	8
5	43416	Intensity of Physical Activity in Physical Education Classes and School Recesses and Its Associations with Body Mass Index and Global Fitness Score in Spanish Schoolchildren	2021	Article	APPLIED SCIENCES-BASEL	Materials Science	7	0	0	9	0	8
5	63373	How Successful Is Transfer Learning for Detecting Anorexia on Social Media?	2021	Article	APPLIED SCIENCES-BASEL	Materials Science	5	0	0	6	0	4
5	70254	Burnout, Resilience, and COVID-19 among Teachers: Predictive Capacity of an Artificial Neural Network	2021	Article	APPLIED SCIENCES-BASEL	Materials Science	3	0	0	4	0	3
5	70305	Editorial special issue women in glass	2020	Editorial Material	INTERNATIONAL JOURNAL OF APPLIED GLASS SCIENCE	Materials Science	3	0	0	4	0	3
5	70306	Anthropometric Profile Assessed by Bioimpedance and Anthropometry Measures of Male and Female Rugby Players Competing in the Spanish National League	2021	Article	APPLIED SCIENCES-BASEL	Materials Science	3	0	0	4	0	8
5	69625	Sutfonate-ended carbosilane dendrimers with a flexible scaffold cause inactivation of HIV-1 virions and gp120 shedding	2018	Article	NANOSCALE	Materials Science	2	0	0	2	0	4
5	70307	Duration of the Symptoms and Brain Aging in Women with Fibromyalgia: A Cross-Sectional Study	2019	Article	APPLIED SCIENCES-BASEL	Materials Science	2	0	0	4	0	5
5	70308	Dapivirine Bioadhesive Vaginal Tablets Based on Natural Polymers for the Prevention of Sexual Transmission of HIV	2019	Article	POLYMERS	Materials Science	1	0	0	1	0	7
5	4651	The Long-Term Effects of Legalizing Divorce on Children	2018	Article	OXFORD BULLETIN OF ECONOMICS AND STATISTICS	Mathematics	9	0	0	13	0	2
5	38383	Uncertainty and sensitivity of the sexual behavior changes to the current human papillomavirus vaccination campaign in Spain	2020	Article	MATHEMATICAL METHODS IN THE APPLIED SCIENCES	Mathematics	7	0	0	11	0	6
5	8445	Determining the likely place of HIV acquisition for migrants in Europe combining subject-specific information and biomarkers data	2019	Article	STATISTICAL METHODS IN MEDICAL RESEARCH	Mathematics	5	0	0	5	0	201
5	17486	Design of phase III trials with long-term survival outcomes based on short-term binary results	2021	Article	STATISTICS IN MEDICINE	Mathematics	4	0	0	5	0	3
5	70163	On measuring the sources of changes in poverty using the Shapley method. An application to Europe	2020	Article	FUZZY SETS AND SYSTEMS	Mathematics	1	0	0	3	0	2
5	1210	Group B Streptococcal Disease Worldwide for Pregnant Women, Stillbirths, and Children: Why, What, and How to Undertake Estimates?	2017	Article	CLINICAL INFECTIOUS DISEASES	Microbiology	291	43	1	45	0	21
5	2820	Building Parasitology Communities to Promote Gender Equality	2020	Editorial Material	TRENDS IN PARASITOLOGY	Microbiology	123	0	0	314	0	3
5	2995	Estimates of the Burden of Group B Streptococcal Disease Worldwide for Pregnant Women, Stillbirths, and Children	2017	Article	CLINICAL INFECTIOUS DISEASES	Microbiology	109	12	2	33	2	23
5	65934	Prevalence of and Risk Factors for Anal High-grade Squamous Intraepithelial Lesions in Women Living with Human Immunodeficiency Virus	2020	Article	CLINICAL INFECTIOUS DISEASES	Microbiology	69	11	0	1	0	19
5	62103	Brexit and United Kingdom citizens with HIV residing in Spain: a matter of public health	2019	Editorial Material	AIDS	Microbiology	61	5	0	32	0	2
5	32441	Predicting critical illness on initial diagnosis of COVID-19 based on easily obtained clinical variables: development and validation of the PRIORITY model	2021	Article	CLINICAL MICROBIOLOGY AND INFECTION	Microbiology	49	3	0	51	0	25
5	45536	Variations in Vaginal, Penile, and Oral Microbiota After Sexual Intercourse: A Case Report	2019	Article	FRONTIERS IN MEDICINE	Microbiology	42	0	0	73	0	6
5	62319	On the Elimination of Infections Related to Oncogenic Human Papillomavirus: An Approach Using a Computational Network Model	2021	Article	VIRUSES-BASEL	Microbiology	40	3	0	21	0	5
5	70309	High levels of postmigration HIV acquisition within nine European countries	2017	Article	AIDS	Microbiology	37	1	6	42	0	15
5	58770	Effect of immediate initiation of antiretroviral treatment on the risk of acquired HIV drug resistance	2018	Article	AIDS	Microbiology	37	1	0	45	0	24
5	919	BOADICEA: a comprehensive breast cancer risk prediction model incorporating genetic and nongenetic risk factors	2019	Article	GENETICS IN MEDICINE	Molecular Biology & Genetics	382	34	0	171	0	17
5	924	The Biological Contributions to Gender Identity and Gender Diversity: Bringing Data to the Table	2018	Review	BEHAVIOR GENETICS	Molecular Biology & Genetics	379	2	0	909	1	13
5	70199	Adenosine/A2B Receptor Signaling Ameliorates the Effects of Aging and Counteracts Obesity	2020	Article	CELL METABOLISM	Molecular Biology & Genetics	162	16	0	69	1	31
5	8648	Gestational diabetes impacts fetal precursor cell responses with potential consequences for offspring	2020	Article	STEM CELLS TRANSLATIONAL MEDICINE	Molecular Biology & Genetics	145	20	0	4	0	14
5	70291	Interleukin-33-induced expression of PIBF1 by decidual B cells protects against preterm labor	2017	Article	NATURE MEDICINE	Molecular Biology & Genetics	136	19	0	52	0	28
5	70310	Identifying occult maternal malignancies from 1.93 million pregnant women undergoing noninvasive prenatal screening tests	2019	Article	GENETICS IN MEDICINE	Molecular Biology & Genetics	116	12	0	27	0	64
5	3543	An exercise program throughout pregnancy: Barakat model	2020	Article	BIRTH DEFECTS RESEARCH	Molecular Biology & Genetics	80	9	0	13	0	1
5	22859	Development of standard definitions and grading for Maternal and Fetal Adverse Event Terminology	2021	Article	PRENATAL DIAGNOSIS	Molecular Biology & Genetics	71	2	0	90	0	26
5	42127	Adipose tissue inflammation and VDR expression and methylation in colorectal cancer	2018	Article	CLINICAL EPIGENETICS	Molecular Biology & Genetics	30	0	0	52	0	8
5	70311	Management of individuals with germline variants in PALB2: a clinical practice resource of the American College of Medical Genetics and Genomics (ACMG)	2021	Article	GENETICS IN MEDICINE	Molecular Biology & Genetics	29	3	0	11	0	10
5	92	Healthy dietary indices and risk of depressive outcomes: a systematic review and meta-analysis of observational studies	2019	Review	MOLECULAR PSYCHIATRY	Neuroscience & Behavior	1713	248	1	442	2	7
5	924	The Biological Contributions to Gender Identity and Gender Diversity: Bringing Data to the Table	2018	Review	BEHAVIOR GENETICS	Neuroscience & Behavior	379	2	0	909	1	13
5	1360	Dietary recommendations for the prevention of depression	2017	Article	NUTRITIONAL NEUROSCIENCE	Neuroscience & Behavior	260	24	0	80	0	7
5	2431	Mediterranean Diet Reduces Atherosclerosis Progression in Coronary Heart Disease An Analysis of the CORDIOPREV Randomized Controlled Trial	2021	Article	STROKE	Neuroscience & Behavior	150	3	0	251	0	14
5	10079	Decline in sexuality and wellbeing in older adults: A population-based study	2019	Article	JOURNAL OF AFFECTIVE DISORDERS	Neuroscience & Behavior	84	11	0	30	0	7
5	70312	Sex Affects the Relationship Between Third Party Punishment and Cooperation	2019	Article	SCIENTIFIC REPORTS	Neuroscience & Behavior	79	0	0	114	0	5
5	45364	Circadian rhythm abnormalities and autonomic dysfunction in patients with Chronic Fatigue Syndrome/Myalgic Encephalomyelitis	2018	Article	PLOS ONE	Neuroscience & Behavior	73	0	0	122	0	5
5	53561	Effectiveness of a structured group intervention based on pain neuroscience education for patients with fibromyalgia in primary care: A multicentre randomized open-label controlled trial	2021	Article	EUROPEAN JOURNAL OF PAIN	Neuroscience & Behavior	73	0	1	142	0	14
5	9915	Handgrip strength and depression among 34,129 adults aged 50 years and older in six low- and middle-income countries	2019	Article	JOURNAL OF AFFECTIVE DISORDERS	Neuroscience & Behavior	65	5	0	32	0	7
5	64576	Altered cerebral blood flow velocity features in fibromyalgia patients in resting-state conditions	2017	Article	PLOS ONE	Neuroscience & Behavior	50	7	0	11	0	6
5	2688	Peripartum management of hypertension: a position paper of the ESC Council on Hypertension and the European Society of Hypertension	2020	Article	EUROPEAN HEART JOURNAL-CARDIOVASCULAR PHARMACOTHERAPY	Pharmacology & Toxicology	131	0	0	260	0	16
5	3452	Correlates of Walking for Travel in Seven European Cities: The PASTA Project	2019	Article	ENVIRONMENTAL HEALTH PERSPECTIVES	Pharmacology & Toxicology	85	6	0	77	1	20
5	3543	An exercise program throughout pregnancy: Barakat model	2020	Article	BIRTH DEFECTS RESEARCH	Pharmacology & Toxicology	80	9	0	13	0	1
5	22996	Differential correlations between maternal hair levels of tobacco and alcohol with fetal growth restriction clinical subtypes	2018	Article	ALCOHOL	Pharmacology & Toxicology	35	0	0	48	0	5
5	70283	Pharmacists' involvement in COVID-19 vaccination across Europe: a situational analysis of current practice and policy	2021	Editorial Material	INTERNATIONAL JOURNAL OF CLINICAL PHARMACY	Pharmacology & Toxicology	30	0	0	49	0	12
